Subject,Business Name,Email,Phone,Website,Industry,Error
123 Digital Limited Saint Lucia,123 Digital Limited,info@123digitallimited.com,+1-758-452-0123,https://www.123digitallimited.com,"Advertising, Marketing, and Technology",
1st National Bank St. Lucia Ltd,1st National Bank St. Lucia Ltd.,manager@1nbslu.com,+1-758-455-7000,https://1stnationalbankonline.com/,Financial Services,
ALL BIZ LTD Saint Lucia,ALL BIZ LTD,allbizlimited@gmail.com,+1-758-453-2418,Not found,Multimedia Production / Creative Media Solutions,
Acado St.Lucia Limited,Acado St.Lucia Limited,customerservice@acadostlucia.com,+1-758-457-7000,https://acadostlucia.com/,Fast-Moving Consumer Goods (FMCG) Distribution,
Athena Law Saint Lucia,Athena Law,mdesir@athenalawslu.com,+1-758-452-5111,https://www.athenalawslu.com/,Legal Services,
Atwell Dalgleish (St. Lucia) Ltd,Atwell Dalgleish (St. Lucia) Ltd.,Info@atwelldalgliesh.com,+1-758-452-3668,https://atwelldalgliesh.com/,"Wholesale Distribution (Janitorial, Plumbing, Hardware, Food Service Supplies)",
Automotive Art (St Lucia) Ltd,Automotive Art (St Lucia) Ltd.,stlucia@automotiveart.com,+1-758-453-6444,https://www.automotiveart.com/St-Lucia/,Automotive Retail / Aftermarket,
BDO Saint Lucia,BDO Saint Lucia,bdolc@bdoecc.com,+1-758-452-2500,https://www.bdoecc.com,Financial Services,
Barbay Ltd Saint Lucia,Barbay Ltd,info@saintluciarums.com,+1-758-456-3100,https://www.saintluciarums.com,Liquor-Wholesale & Manufacturers,
Baron Foods Ltd Saint Lucia,Baron Foods (St. Lucia) Limited,info@baronfoodsltd.com,+1-758-454-9230,https://www.baronfoodsltd.com/,Food Manufacturing,
Basic Blue Saint Lucia,Basic Blue Ltd.,info@basicblueslu.com,+1-758-458-0351,https://basicblueslu.com/,"Retail (Clothing, Footwear, and Accessories)",
Beachcomber Ltd Saint Lucia,Beachcomber Ltd,info@beachcomberltd.com,+1-758-452-5241,https://beachcomberltd.com/,Automotive/Vehicle Dealership,
Hewanorra Air Cargo Services,Hewanorra Air Cargo Services,info@hacscargo.com,+1-758-454-8686,https://www.hacscargo.com/,Air Cargo Services,
Hi Tech Direct Saint Lucia,Hi Tech Direct,Not found,Not found,Not found,IT Consulting and Distribution,
IDEQ Caribbean Saint Lucia,IDEQ Caribbean Ltd.,info@ideqcaribbean.com,+1-758-572-0292,https://www.ideqcaribbean.com,Indoor Environmental Quality Testing and Consulting,
Colonial Trust Company Saint Lucia,Colonial Trust Company Ltd.,info@thecolonialtrust.com,+1-758-453-7777,https://thecolonialtrust.com/,Financial Services,
Brickstone Law Saint Lucia,Brickstone Law,info@brickstonelaw.com,+1-758-450-3000,https://www.brickstonelaw.com/,Legal Service,
St. Lucia Linen Services Ltd,St. Lucia Linen Services Ltd.,admin@stlucialinen.com,+1-758-450-2924,https://www.stlucialinen.com,Laundry Services,
